{
  "schema_version": "oncoforge.evidence.v1",
  "project_id": "FIXTURE:TARGET_FORGE_V1",
  "entities": [
    {"entity_id": "FIXTURE:TUMOR_1", "kind": "Sample", "label": "Synthetic tumor 1", "attributes": {"role": "tumor", "tissue": "synthetic tumor", "cell_type": "malignant", "clone_id": "FIXTURE:CLONE_A", "patient_id": "FIXTURE:PATIENT_1"}},
    {"entity_id": "FIXTURE:TUMOR_2", "kind": "Sample", "label": "Synthetic tumor 2", "attributes": {"role": "tumor", "tissue": "synthetic tumor", "cell_type": "malignant", "clone_id": "FIXTURE:CLONE_B", "patient_id": "FIXTURE:PATIENT_1"}},
    {"entity_id": "FIXTURE:TUMOR_3", "kind": "Sample", "label": "Synthetic tumor 3", "attributes": {"role": "tumor", "tissue": "synthetic tumor", "cell_type": "malignant", "clone_id": "FIXTURE:CLONE_C", "patient_id": "FIXTURE:PATIENT_2"}},
    {"entity_id": "FIXTURE:NORMAL_1", "kind": "Sample", "label": "Synthetic critical normal 1", "attributes": {"role": "normal", "tissue": "synthetic vital tissue", "cell_type": "normal", "critical_normal": true}},
    {"entity_id": "FIXTURE:NORMAL_2", "kind": "Sample", "label": "Synthetic critical normal 2", "attributes": {"role": "normal", "tissue": "synthetic vital tissue", "cell_type": "normal", "critical_normal": true}},
    {"entity_id": "FIXTURE:NORMAL_3", "kind": "Sample", "label": "Synthetic normal 3", "attributes": {"role": "normal", "tissue": "synthetic noncritical tissue", "cell_type": "normal", "critical_normal": false}},
    {"entity_id": "FIXTURE:SURFACE_A", "kind": "ProteinSurfaceTarget", "label": "Synthetic surface target A", "identifiers": {"fixture": "SURFACE_A"}},
    {"entity_id": "FIXTURE:SURFACE_B", "kind": "ProteinSurfaceTarget", "label": "Synthetic surface target B", "identifiers": {"fixture": "SURFACE_B"}},
    {"entity_id": "FIXTURE:SURFACE_C", "kind": "ProteinSurfaceTarget", "label": "Synthetic normal-exclusion target C", "identifiers": {"fixture": "SURFACE_C"}}
  ],
  "sources": [
    {
      "source_id": "FIXTURE:TARGET_FORGE_SOURCE_V1",
      "title": "OncoForge Target Forge synthetic fixture",
      "source_type": "synthetic_fixture",
      "version": "1",
      "content_hash": "e9de362bd99771dd87fb64f350178c87e2d7c6abd0c94658e9c24d2c899c22e3",
      "accessed_on": "2026-08-15",
      "license_note": "Test and demonstration data only",
      "transformation_history": ["Hand-authored deterministic logic-gate fixture; no patient data or biological claim"],
      "identifier_mapping": {"namespace": "FIXTURE"}
    }
  ],
  "assertions": [
    {"assertion_id": "FIXTURE:OBS_T1_A", "subject_id": "FIXTURE:TUMOR_1", "relation": "TARGET_MEASUREMENT", "object_id": "FIXTURE:SURFACE_A", "value": {"feature": "surface_abundance", "value": 9.0, "positive_threshold": 5.0, "direction": "higher_is_positive", "unit": "synthetic_units"}, "source_id": "FIXTURE:TARGET_FORGE_SOURCE_V1", "source_record_id": "T1:A", "evidence_class": "synthetic_fixture", "claim_category": "SIMULATED", "limitations": ["Synthetic fixture value; not biological evidence"]},
    {"assertion_id": "FIXTURE:OBS_T1_B", "subject_id": "FIXTURE:TUMOR_1", "relation": "TARGET_MEASUREMENT", "object_id": "FIXTURE:SURFACE_B", "value": {"feature": "surface_abundance", "value": 8.0, "positive_threshold": 5.0, "direction": "higher_is_positive", "unit": "synthetic_units"}, "source_id": "FIXTURE:TARGET_FORGE_SOURCE_V1", "source_record_id": "T1:B", "evidence_class": "synthetic_fixture", "claim_category": "SIMULATED", "limitations": ["Synthetic fixture value; not biological evidence"]},
    {"assertion_id": "FIXTURE:OBS_T1_C", "subject_id": "FIXTURE:TUMOR_1", "relation": "TARGET_MEASUREMENT", "object_id": "FIXTURE:SURFACE_C", "value": {"feature": "surface_abundance", "value": 1.0, "positive_threshold": 5.0, "direction": "higher_is_positive", "unit": "synthetic_units"}, "source_id": "FIXTURE:TARGET_FORGE_SOURCE_V1", "source_record_id": "T1:C", "evidence_class": "synthetic_fixture", "claim_category": "SIMULATED", "limitations": ["Synthetic fixture value; not biological evidence"]},
    {"assertion_id": "FIXTURE:OBS_T2_A", "subject_id": "FIXTURE:TUMOR_2", "relation": "TARGET_MEASUREMENT", "object_id": "FIXTURE:SURFACE_A", "value": {"feature": "surface_abundance", "value": 8.0, "positive_threshold": 5.0, "direction": "higher_is_positive", "unit": "synthetic_units"}, "source_id": "FIXTURE:TARGET_FORGE_SOURCE_V1", "source_record_id": "T2:A", "evidence_class": "synthetic_fixture", "claim_category": "SIMULATED", "limitations": ["Synthetic fixture value; not biological evidence"]},
    {"assertion_id": "FIXTURE:OBS_T2_B", "subject_id": "FIXTURE:TUMOR_2", "relation": "TARGET_MEASUREMENT", "object_id": "FIXTURE:SURFACE_B", "value": {"feature": "surface_abundance", "value": 7.0, "positive_threshold": 5.0, "direction": "higher_is_positive", "unit": "synthetic_units"}, "source_id": "FIXTURE:TARGET_FORGE_SOURCE_V1", "source_record_id": "T2:B", "evidence_class": "synthetic_fixture", "claim_category": "SIMULATED", "limitations": ["Synthetic fixture value; not biological evidence"]},
    {"assertion_id": "FIXTURE:OBS_T2_C", "subject_id": "FIXTURE:TUMOR_2", "relation": "TARGET_MEASUREMENT", "object_id": "FIXTURE:SURFACE_C", "value": {"feature": "surface_abundance", "value": 2.0, "positive_threshold": 5.0, "direction": "higher_is_positive", "unit": "synthetic_units"}, "source_id": "FIXTURE:TARGET_FORGE_SOURCE_V1", "source_record_id": "T2:C", "evidence_class": "synthetic_fixture", "claim_category": "SIMULATED", "limitations": ["Synthetic fixture value; not biological evidence"]},
    {"assertion_id": "FIXTURE:OBS_T3_A", "subject_id": "FIXTURE:TUMOR_3", "relation": "TARGET_MEASUREMENT", "object_id": "FIXTURE:SURFACE_A", "value": {"feature": "surface_abundance", "value": 7.0, "positive_threshold": 5.0, "direction": "higher_is_positive", "unit": "synthetic_units"}, "source_id": "FIXTURE:TARGET_FORGE_SOURCE_V1", "source_record_id": "T3:A", "evidence_class": "synthetic_fixture", "claim_category": "SIMULATED", "limitations": ["Synthetic fixture value; not biological evidence"]},
    {"assertion_id": "FIXTURE:OBS_T3_B", "subject_id": "FIXTURE:TUMOR_3", "relation": "TARGET_MEASUREMENT", "object_id": "FIXTURE:SURFACE_B", "value": {"feature": "surface_abundance", "value": 2.0, "positive_threshold": 5.0, "direction": "higher_is_positive", "unit": "synthetic_units"}, "source_id": "FIXTURE:TARGET_FORGE_SOURCE_V1", "source_record_id": "T3:B", "evidence_class": "synthetic_fixture", "claim_category": "SIMULATED", "limitations": ["Synthetic fixture value; not biological evidence"]},
    {"assertion_id": "FIXTURE:OBS_T3_C", "subject_id": "FIXTURE:TUMOR_3", "relation": "TARGET_MEASUREMENT", "object_id": "FIXTURE:SURFACE_C", "value": {"feature": "surface_abundance", "value": 1.0, "positive_threshold": 5.0, "direction": "higher_is_positive", "unit": "synthetic_units"}, "source_id": "FIXTURE:TARGET_FORGE_SOURCE_V1", "source_record_id": "T3:C", "evidence_class": "synthetic_fixture", "claim_category": "SIMULATED", "limitations": ["Synthetic fixture value; not biological evidence"]},
    {"assertion_id": "FIXTURE:OBS_N1_A", "subject_id": "FIXTURE:NORMAL_1", "relation": "TARGET_MEASUREMENT", "object_id": "FIXTURE:SURFACE_A", "value": {"feature": "surface_abundance", "value": 8.0, "positive_threshold": 5.0, "direction": "higher_is_positive", "unit": "synthetic_units"}, "source_id": "FIXTURE:TARGET_FORGE_SOURCE_V1", "source_record_id": "N1:A", "evidence_class": "synthetic_fixture", "claim_category": "SIMULATED", "limitations": ["Synthetic fixture value; not biological evidence"]},
    {"assertion_id": "FIXTURE:OBS_N1_B", "subject_id": "FIXTURE:NORMAL_1", "relation": "TARGET_MEASUREMENT", "object_id": "FIXTURE:SURFACE_B", "value": {"feature": "surface_abundance", "value": 1.0, "positive_threshold": 5.0, "direction": "higher_is_positive", "unit": "synthetic_units"}, "source_id": "FIXTURE:TARGET_FORGE_SOURCE_V1", "source_record_id": "N1:B", "evidence_class": "synthetic_fixture", "claim_category": "SIMULATED", "limitations": ["Synthetic fixture value; not biological evidence"]},
    {"assertion_id": "FIXTURE:OBS_N1_C", "subject_id": "FIXTURE:NORMAL_1", "relation": "TARGET_MEASUREMENT", "object_id": "FIXTURE:SURFACE_C", "value": {"feature": "surface_abundance", "value": 9.0, "positive_threshold": 5.0, "direction": "higher_is_positive", "unit": "synthetic_units"}, "source_id": "FIXTURE:TARGET_FORGE_SOURCE_V1", "source_record_id": "N1:C", "evidence_class": "synthetic_fixture", "claim_category": "SIMULATED", "limitations": ["Synthetic fixture value; not biological evidence"]},
    {"assertion_id": "FIXTURE:OBS_N2_A", "subject_id": "FIXTURE:NORMAL_2", "relation": "TARGET_MEASUREMENT", "object_id": "FIXTURE:SURFACE_A", "value": {"feature": "surface_abundance", "value": 7.0, "positive_threshold": 5.0, "direction": "higher_is_positive", "unit": "synthetic_units"}, "source_id": "FIXTURE:TARGET_FORGE_SOURCE_V1", "source_record_id": "N2:A", "evidence_class": "synthetic_fixture", "claim_category": "SIMULATED", "limitations": ["Synthetic fixture value; not biological evidence"]},
    {"assertion_id": "FIXTURE:OBS_N2_B", "subject_id": "FIXTURE:NORMAL_2", "relation": "TARGET_MEASUREMENT", "object_id": "FIXTURE:SURFACE_B", "value": {"feature": "surface_abundance", "value": 2.0, "positive_threshold": 5.0, "direction": "higher_is_positive", "unit": "synthetic_units"}, "source_id": "FIXTURE:TARGET_FORGE_SOURCE_V1", "source_record_id": "N2:B", "evidence_class": "synthetic_fixture", "claim_category": "SIMULATED", "limitations": ["Synthetic fixture value; not biological evidence"]},